<?xml version="1.0"?>
<PRACOWNICY xmlns:xsi="http://www.w3.org/2001/XMLSchema-instance" xsi:noNamespaceSchemaLocation="emp1.xsd">
 <PRACOWNIK>
  <ID_PRAC>100</ID_PRAC>
  <NAZWISKO>WEGLARZ</NAZWISKO>
  <ETAT>DYREKTOR</ETAT>
  <ZATRUDNIONY>1968-01-01</ZATRUDNIONY>
  <PLACA_POD>1730</PLACA_POD>
  <PLACA_DOD>420.5</PLACA_DOD>
  <ID_ZESP>10</ID_ZESP>
 </PRACOWNIK>
 <PRACOWNIK>
  <ID_PRAC>110</ID_PRAC>
  <NAZWISKO>BLAZEWICZ</NAZWISKO>
  <ETAT>PROFESOR</ETAT>
  <ID_SZEFA>100</ID_SZEFA>
  <ZATRUDNIONY>1973-05-01</ZATRUDNIONY>
  <PLACA_POD>1350</PLACA_POD>
  <PLACA_DOD>210</PLACA_DOD>
  <ID_ZESP>40</ID_ZESP>
 </PRACOWNIK>
 <PRACOWNIK>
  <ID_PRAC>120</ID_PRAC>
  <NAZWISKO>SLOWINSKI</NAZWISKO>
  <ETAT>PROFESOR</ETAT>
  <ID_SZEFA>100</ID_SZEFA>
  <ZATRUDNIONY>1977-09-01</ZATRUDNIONY>
  <PLACA_POD>1177</PLACA_POD>
  <ID_ZESP>30</ID_ZESP>
 </PRACOWNIK>
 <PRACOWNIK>
  <ID_PRAC>130</ID_PRAC>
  <NAZWISKO>BRZEZINSKI</NAZWISKO>
  <ETAT>PROFESOR</ETAT>
  <ID_SZEFA>100</ID_SZEFA>
  <ZATRUDNIONY>1968-07-01</ZATRUDNIONY>
  <PLACA_POD>960</PLACA_POD>
  <ID_ZESP>20</ID_ZESP>
 </PRACOWNIK>
</PRACOWNICY>
